========================================
WEBSITE PERFORMANCE TESTING
========================================

This will test:
- Page Load Speed
- Database Query Performance
- Data Scalability
- Concurrent User Load
- Overall Reliability

========================================

Make sure server is running!
Press Ctrl+C to cancel
========================================

Make sure server is running!
========================================

Make sure server is running!
========================================


Make sure server is running!
Press Ctrl+C to cancel

Press any key to continue . . .

Starting tests...


============================================================
WEBSITE PERFORMANCE & RELIABILITY TEST
============================================================
Started: 2025-12-16 21:00:31
============================================================
Setting up test user...
✓ Test user logged in

============================================================
PAGE LOAD TESTING
============================================================

Testing: Dashboard...
Dashboard: Checking 20 products for low stock
Dashboard: Total low stock products found: 0
Dashboard: Looking for products expiring before 2026-01-15
Dashboard: Found 50 purchases with expiry dates
Dashboard: Total expired/expiring products found: 0
Dashboard context: low_stock=0, expired=0
Dashboard: Checking 20 products for low stock
Dashboard: Total low stock products found: 0
Dashboard: Looking for products expiring before 2026-01-15
Dashboard: Found 50 purchases with expiry dates
Dashboard: Total expired/expiring products found: 0
Dashboard context: low_stock=0, expired=0
Dashboard: Checking 20 products for low stock
Dashboard: Total low stock products found: 0
Dashboard: Looking for products expiring before 2026-01-15
Dashboard: Found 50 purchases with expiry dates
Dashboard: Total expired/expiring products found: 0
Dashboard context: low_stock=0, expired=0
Dashboard: Checking 20 products for low stock
Dashboard: Total low stock products found: 0
Dashboard: Looking for products expiring before 2026-01-15
Dashboard: Found 50 purchases with expiry dates
Dashboard: Total expired/expiring products found: 0
Dashboard context: low_stock=0, expired=0
Dashboard: Checking 20 products for low stock
Dashboard: Total low stock products found: 0
Dashboard: Looking for products expiring before 2026-01-15
Dashboard: Found 50 purchases with expiry dates
Dashboard: Total expired/expiring products found: 0
Dashboard context: low_stock=0, expired=0
  ⚠ SLOW: 60.031s (max: 70.839s)

Testing: Products List...
📊 Processing inventory for Product 1 - Found 20 unique batches
📊 Processing inventory for Product 2 - Found 23 unique batches
📊 Processing inventory for Product 3 - Found 14 unique batches
📊 Processing inventory for Product 4 - Found 15 unique batches
📊 Processing inventory for Product 5 - Found 15 unique batches
📊 Processing inventory for Product 6 - Found 18 unique batches
📊 Processing inventory for Product 7 - Found 9 unique batches
📊 Processing inventory for Product 8 - Found 19 unique batches
📊 Processing inventory for Product 9 - Found 23 unique batches
📊 Processing inventory for Product 10 - Found 12 unique batches
📊 Processing inventory for Product 11 - Found 12 unique batches
📊 Processing inventory for Product 12 - Found 15 unique batches
📊 Processing inventory for Product 13 - Found 20 unique batches
📊 Processing inventory for Product 14 - Found 15 unique batches
📊 Processing inventory for Product 15 - Found 14 unique batches
📊 Processing inventory for Product 16 - Found 14 unique batches
📊 Processing inventory for Product 17 - Found 19 unique batches
📊 Processing inventory for Product 18 - Found 18 unique batches
📊 Processing inventory for Product 19 - Found 15 unique batches
📊 Processing inventory for Product 20 - Found 15 unique batches
📊 Processing inventory for Product 21 - Found 20 unique batches
📊 Processing inventory for Product 22 - Found 21 unique batches
📊 Processing inventory for Product 23 - Found 14 unique batches
📊 Processing inventory for Product 24 - Found 16 unique batches
📊 Processing inventory for Product 25 - Found 9 unique batches
📊 Processing inventory for Product 26 - Found 13 unique batches
📊 Processing inventory for Product 27 - Found 10 unique batches
📊 Processing inventory for Product 28 - Found 9 unique batches
📊 Processing inventory for Product 29 - Found 15 unique batches
📊 Processing inventory for Product 30 - Found 13 unique batches
📊 Processing inventory for Product 1 - Found 20 unique batches
📊 Processing inventory for Product 2 - Found 23 unique batches
📊 Processing inventory for Product 3 - Found 14 unique batches
📊 Processing inventory for Product 4 - Found 15 unique batches
📊 Processing inventory for Product 5 - Found 15 unique batches
📊 Processing inventory for Product 6 - Found 18 unique batches
📊 Processing inventory for Product 7 - Found 9 unique batches
📊 Processing inventory for Product 8 - Found 19 unique batches
📊 Processing inventory for Product 9 - Found 23 unique batches
📊 Processing inventory for Product 10 - Found 12 unique batches
📊 Processing inventory for Product 11 - Found 12 unique batches
📊 Processing inventory for Product 12 - Found 15 unique batches
📊 Processing inventory for Product 13 - Found 20 unique batches
📊 Processing inventory for Product 14 - Found 15 unique batches
📊 Processing inventory for Product 15 - Found 14 unique batches
📊 Processing inventory for Product 16 - Found 14 unique batches
📊 Processing inventory for Product 17 - Found 19 unique batches
📊 Processing inventory for Product 18 - Found 18 unique batches
📊 Processing inventory for Product 19 - Found 15 unique batches
📊 Processing inventory for Product 20 - Found 15 unique batches
📊 Processing inventory for Product 21 - Found 20 unique batches
📊 Processing inventory for Product 22 - Found 21 unique batches
📊 Processing inventory for Product 23 - Found 14 unique batches
📊 Processing inventory for Product 24 - Found 16 unique batches
📊 Processing inventory for Product 25 - Found 9 unique batches
📊 Processing inventory for Product 26 - Found 13 unique batches
📊 Processing inventory for Product 27 - Found 10 unique batches
📊 Processing inventory for Product 28 - Found 9 unique batches
📊 Processing inventory for Product 29 - Found 15 unique batches
📊 Processing inventory for Product 30 - Found 13 unique batches
📊 Processing inventory for Product 1 - Found 20 unique batches
📊 Processing inventory for Product 2 - Found 23 unique batches
📊 Processing inventory for Product 3 - Found 14 unique batches
📊 Processing inventory for Product 4 - Found 15 unique batches
📊 Processing inventory for Product 5 - Found 15 unique batches
📊 Processing inventory for Product 6 - Found 18 unique batches
📊 Processing inventory for Product 7 - Found 9 unique batches
📊 Processing inventory for Product 8 - Found 19 unique batches
📊 Processing inventory for Product 9 - Found 23 unique batches
📊 Processing inventory for Product 10 - Found 12 unique batches
📊 Processing inventory for Product 11 - Found 12 unique batches
📊 Processing inventory for Product 12 - Found 15 unique batches
📊 Processing inventory for Product 13 - Found 20 unique batches
📊 Processing inventory for Product 14 - Found 15 unique batches
📊 Processing inventory for Product 15 - Found 14 unique batches
📊 Processing inventory for Product 16 - Found 14 unique batches
📊 Processing inventory for Product 17 - Found 19 unique batches
📊 Processing inventory for Product 18 - Found 18 unique batches
📊 Processing inventory for Product 19 - Found 15 unique batches
📊 Processing inventory for Product 20 - Found 15 unique batches
📊 Processing inventory for Product 21 - Found 20 unique batches
📊 Processing inventory for Product 22 - Found 21 unique batches
📊 Processing inventory for Product 23 - Found 14 unique batches
📊 Processing inventory for Product 24 - Found 16 unique batches
📊 Processing inventory for Product 25 - Found 9 unique batches
📊 Processing inventory for Product 26 - Found 13 unique batches
📊 Processing inventory for Product 27 - Found 10 unique batches
📊 Processing inventory for Product 28 - Found 9 unique batches
📊 Processing inventory for Product 29 - Found 15 unique batches
📊 Processing inventory for Product 30 - Found 13 unique batches
📊 Processing inventory for Product 1 - Found 20 unique batches
📊 Processing inventory for Product 2 - Found 23 unique batches
📊 Processing inventory for Product 3 - Found 14 unique batches
📊 Processing inventory for Product 4 - Found 15 unique batches
📊 Processing inventory for Product 5 - Found 15 unique batches
📊 Processing inventory for Product 6 - Found 18 unique batches
📊 Processing inventory for Product 7 - Found 9 unique batches
📊 Processing inventory for Product 8 - Found 19 unique batches
📊 Processing inventory for Product 9 - Found 23 unique batches
📊 Processing inventory for Product 10 - Found 12 unique batches
📊 Processing inventory for Product 11 - Found 12 unique batches
📊 Processing inventory for Product 12 - Found 15 unique batches
📊 Processing inventory for Product 13 - Found 20 unique batches
📊 Processing inventory for Product 14 - Found 15 unique batches
📊 Processing inventory for Product 15 - Found 14 unique batches
📊 Processing inventory for Product 16 - Found 14 unique batches
📊 Processing inventory for Product 17 - Found 19 unique batches
📊 Processing inventory for Product 18 - Found 18 unique batches
📊 Processing inventory for Product 19 - Found 15 unique batches
📊 Processing inventory for Product 20 - Found 15 unique batches
📊 Processing inventory for Product 21 - Found 20 unique batches
📊 Processing inventory for Product 22 - Found 21 unique batches
📊 Processing inventory for Product 23 - Found 14 unique batches
📊 Processing inventory for Product 24 - Found 16 unique batches
📊 Processing inventory for Product 25 - Found 9 unique batches
📊 Processing inventory for Product 26 - Found 13 unique batches
📊 Processing inventory for Product 27 - Found 10 unique batches
📊 Processing inventory for Product 28 - Found 9 unique batches
📊 Processing inventory for Product 29 - Found 15 unique batches
📊 Processing inventory for Product 30 - Found 13 unique batches
📊 Processing inventory for Product 1 - Found 20 unique batches
📊 Processing inventory for Product 2 - Found 23 unique batches
📊 Processing inventory for Product 3 - Found 14 unique batches
📊 Processing inventory for Product 4 - Found 15 unique batches
📊 Processing inventory for Product 5 - Found 15 unique batches
📊 Processing inventory for Product 6 - Found 18 unique batches
📊 Processing inventory for Product 7 - Found 9 unique batches
📊 Processing inventory for Product 8 - Found 19 unique batches
📊 Processing inventory for Product 9 - Found 23 unique batches
📊 Processing inventory for Product 10 - Found 12 unique batches
📊 Processing inventory for Product 11 - Found 12 unique batches
📊 Processing inventory for Product 12 - Found 15 unique batches
📊 Processing inventory for Product 13 - Found 20 unique batches
📊 Processing inventory for Product 14 - Found 15 unique batches
📊 Processing inventory for Product 15 - Found 14 unique batches
📊 Processing inventory for Product 16 - Found 14 unique batches
📊 Processing inventory for Product 17 - Found 19 unique batches
📊 Processing inventory for Product 18 - Found 18 unique batches
📊 Processing inventory for Product 19 - Found 15 unique batches
📊 Processing inventory for Product 20 - Found 15 unique batches
📊 Processing inventory for Product 21 - Found 20 unique batches
📊 Processing inventory for Product 22 - Found 21 unique batches
📊 Processing inventory for Product 23 - Found 14 unique batches
📊 Processing inventory for Product 24 - Found 16 unique batches
📊 Processing inventory for Product 25 - Found 9 unique batches
📊 Processing inventory for Product 26 - Found 13 unique batches
📊 Processing inventory for Product 27 - Found 10 unique batches
📊 Processing inventory for Product 28 - Found 9 unique batches
📊 Processing inventory for Product 29 - Found 15 unique batches
📊 Processing inventory for Product 30 - Found 13 unique batches
  ⚠ SLOW: 34.493s (max: 44.728s)

Testing: Suppliers List...
  ✓ PASSED: 0.029s (max: 0.098s)

Testing: Customers List...
  ✓ PASSED: 0.025s (max: 0.071s)

Testing: Purchase Invoices...
  ✓ PASSED: 0.190s (max: 0.250s)

Testing: Sales Invoices...
  ✓ PASSED: 0.259s (max: 0.317s)

Testing: Purchase Returns...
  ✓ PASSED: 0.149s (max: 0.200s)

Testing: Sales Returns...
  ✓ PASSED: 0.149s (max: 0.200s)

Testing: Supplier Challans...
  ✓ PASSED: 0.199s (max: 0.252s)

Testing: Customer Challans...
  ✓ PASSED: 0.131s (max: 0.171s)

Testing: Inventory...
📊 Processing inventory for Product 2 - Found 23 unique batches
📊 Processing inventory for Product 3 - Found 14 unique batches
📊 Processing inventory for Product 1 - Found 20 unique batches
📊 Processing inventory for Product 4 - Found 15 unique batches
📊 Processing inventory for Product 5 - Found 15 unique batches
📊 Processing inventory for Product 6 - Found 18 unique batches
📊 Processing inventory for Product 7 - Found 9 unique batches
📊 Processing inventory for Product 8 - Found 19 unique batches
📊 Processing inventory for Product 9 - Found 23 unique batches
📊 Processing inventory for Product 10 - Found 12 unique batches
📊 Processing inventory for Product 11 - Found 12 unique batches
📊 Processing inventory for Product 12 - Found 15 unique batches
📊 Processing inventory for Product 13 - Found 20 unique batches
📊 Processing inventory for Product 14 - Found 15 unique batches
📊 Processing inventory for Product 15 - Found 14 unique batches
📊 Processing inventory for Product 16 - Found 14 unique batches
📊 Processing inventory for Product 17 - Found 19 unique batches
📊 Processing inventory for Product 18 - Found 18 unique batches
📊 Processing inventory for Product 19 - Found 15 unique batches
📊 Processing inventory for Product 20 - Found 15 unique batches
📊 Processing inventory for Product 21 - Found 20 unique batches
📊 Processing inventory for Product 22 - Found 21 unique batches
📊 Processing inventory for Product 23 - Found 14 unique batches
📊 Processing inventory for Product 24 - Found 16 unique batches
📊 Processing inventory for Product 25 - Found 9 unique batches
📊 Processing inventory for Product 26 - Found 13 unique batches
📊 Processing inventory for Product 28 - Found 9 unique batches
📊 Processing inventory for Product 29 - Found 15 unique batches
📊 Processing inventory for Product 27 - Found 10 unique batches
📊 Processing inventory for Product 31 - Found 12 unique batches
📊 Processing inventory for Product 32 - Found 28 unique batches
📊 Processing inventory for Product 30 - Found 13 unique batches
📊 Processing inventory for Product 33 - Found 16 unique batches
📊 Processing inventory for Product 34 - Found 10 unique batches
📊 Processing inventory for Product 35 - Found 14 unique batches
📊 Processing inventory for Product 42 - Found 16 unique batches
📊 Processing inventory for Product 36 - Found 16 unique batches
📊 Processing inventory for Product 37 - Found 13 unique batches
📊 Processing inventory for Product 38 - Found 12 unique batches
📊 Processing inventory for Product 39 - Found 14 unique batches
📊 Processing inventory for Product 40 - Found 14 unique batches
📊 Processing inventory for Product 41 - Found 14 unique batches
📊 Processing inventory for Product 44 - Found 13 unique batches
📊 Processing inventory for Product 43 - Found 14 unique batches
📊 Processing inventory for Product 45 - Found 14 unique batches
📊 Processing inventory for Product 46 - Found 21 unique batches
📊 Processing inventory for Product 47 - Found 16 unique batches
📊 Processing inventory for Product 48 - Found 14 unique batches
📊 Processing inventory for Product 49 - Found 10 unique batches
📊 Processing inventory for Product 50 - Found 22 unique batches
📊 Processing inventory for Product 2 - Found 23 unique batches
📊 Processing inventory for Product 3 - Found 14 unique batches
📊 Processing inventory for Product 1 - Found 20 unique batches
📊 Processing inventory for Product 4 - Found 15 unique batches
📊 Processing inventory for Product 5 - Found 15 unique batches
📊 Processing inventory for Product 6 - Found 18 unique batches
📊 Processing inventory for Product 7 - Found 9 unique batches
📊 Processing inventory for Product 8 - Found 19 unique batches
📊 Processing inventory for Product 9 - Found 23 unique batches
📊 Processing inventory for Product 10 - Found 12 unique batches
📊 Processing inventory for Product 11 - Found 12 unique batches
📊 Processing inventory for Product 12 - Found 15 unique batches
📊 Processing inventory for Product 13 - Found 20 unique batches
📊 Processing inventory for Product 14 - Found 15 unique batches
📊 Processing inventory for Product 15 - Found 14 unique batches
📊 Processing inventory for Product 16 - Found 14 unique batches
📊 Processing inventory for Product 17 - Found 19 unique batches
📊 Processing inventory for Product 18 - Found 18 unique batches
📊 Processing inventory for Product 19 - Found 15 unique batches
📊 Processing inventory for Product 20 - Found 15 unique batches
📊 Processing inventory for Product 21 - Found 20 unique batches
📊 Processing inventory for Product 22 - Found 21 unique batches
📊 Processing inventory for Product 23 - Found 14 unique batches
📊 Processing inventory for Product 24 - Found 16 unique batches
📊 Processing inventory for Product 25 - Found 9 unique batches
📊 Processing inventory for Product 26 - Found 13 unique batches
📊 Processing inventory for Product 28 - Found 9 unique batches
📊 Processing inventory for Product 29 - Found 15 unique batches
📊 Processing inventory for Product 27 - Found 10 unique batches
📊 Processing inventory for Product 31 - Found 12 unique batches
📊 Processing inventory for Product 32 - Found 28 unique batches
📊 Processing inventory for Product 30 - Found 13 unique batches
📊 Processing inventory for Product 33 - Found 16 unique batches
📊 Processing inventory for Product 34 - Found 10 unique batches
📊 Processing inventory for Product 35 - Found 14 unique batches
📊 Processing inventory for Product 42 - Found 16 unique batches
📊 Processing inventory for Product 36 - Found 16 unique batches
📊 Processing inventory for Product 37 - Found 13 unique batches
📊 Processing inventory for Product 38 - Found 12 unique batches
📊 Processing inventory for Product 39 - Found 14 unique batches
📊 Processing inventory for Product 40 - Found 14 unique batches
📊 Processing inventory for Product 41 - Found 14 unique batches
📊 Processing inventory for Product 44 - Found 13 unique batches
📊 Processing inventory for Product 43 - Found 14 unique batches
📊 Processing inventory for Product 45 - Found 14 unique batches
📊 Processing inventory for Product 46 - Found 21 unique batches
📊 Processing inventory for Product 47 - Found 16 unique batches
📊 Processing inventory for Product 48 - Found 14 unique batches
📊 Processing inventory for Product 49 - Found 10 unique batches
📊 Processing inventory for Product 50 - Found 22 unique batches
📊 Processing inventory for Product 2 - Found 23 unique batches
📊 Processing inventory for Product 3 - Found 14 unique batches
📊 Processing inventory for Product 1 - Found 20 unique batches
📊 Processing inventory for Product 4 - Found 15 unique batches
📊 Processing inventory for Product 5 - Found 15 unique batches
📊 Processing inventory for Product 6 - Found 18 unique batches
📊 Processing inventory for Product 7 - Found 9 unique batches
📊 Processing inventory for Product 8 - Found 19 unique batches
📊 Processing inventory for Product 9 - Found 23 unique batches
📊 Processing inventory for Product 10 - Found 12 unique batches
📊 Processing inventory for Product 11 - Found 12 unique batches
📊 Processing inventory for Product 12 - Found 15 unique batches
📊 Processing inventory for Product 13 - Found 20 unique batches
📊 Processing inventory for Product 14 - Found 15 unique batches
📊 Processing inventory for Product 15 - Found 14 unique batches
📊 Processing inventory for Product 16 - Found 14 unique batches
📊 Processing inventory for Product 17 - Found 19 unique batches
📊 Processing inventory for Product 18 - Found 18 unique batches
📊 Processing inventory for Product 19 - Found 15 unique batches
📊 Processing inventory for Product 20 - Found 15 unique batches
📊 Processing inventory for Product 21 - Found 20 unique batches
📊 Processing inventory for Product 22 - Found 21 unique batches
📊 Processing inventory for Product 23 - Found 14 unique batches
📊 Processing inventory for Product 24 - Found 16 unique batches
📊 Processing inventory for Product 25 - Found 9 unique batches
📊 Processing inventory for Product 26 - Found 13 unique batches
📊 Processing inventory for Product 28 - Found 9 unique batches
📊 Processing inventory for Product 29 - Found 15 unique batches
📊 Processing inventory for Product 27 - Found 10 unique batches
📊 Processing inventory for Product 31 - Found 12 unique batches
📊 Processing inventory for Product 32 - Found 28 unique batches
📊 Processing inventory for Product 30 - Found 13 unique batches
📊 Processing inventory for Product 33 - Found 16 unique batches
📊 Processing inventory for Product 34 - Found 10 unique batches
📊 Processing inventory for Product 35 - Found 14 unique batches
📊 Processing inventory for Product 42 - Found 16 unique batches
📊 Processing inventory for Product 36 - Found 16 unique batches
📊 Processing inventory for Product 37 - Found 13 unique batches
📊 Processing inventory for Product 38 - Found 12 unique batches
📊 Processing inventory for Product 39 - Found 14 unique batches
📊 Processing inventory for Product 40 - Found 14 unique batches
📊 Processing inventory for Product 41 - Found 14 unique batches
📊 Processing inventory for Product 44 - Found 13 unique batches
📊 Processing inventory for Product 43 - Found 14 unique batches
📊 Processing inventory for Product 45 - Found 14 unique batches
📊 Processing inventory for Product 46 - Found 21 unique batches
📊 Processing inventory for Product 47 - Found 16 unique batches
📊 Processing inventory for Product 48 - Found 14 unique batches
📊 Processing inventory for Product 49 - Found 10 unique batches
📊 Processing inventory for Product 50 - Found 22 unique batches
📊 Processing inventory for Product 2 - Found 23 unique batches
📊 Processing inventory for Product 3 - Found 14 unique batches
📊 Processing inventory for Product 1 - Found 20 unique batches
📊 Processing inventory for Product 4 - Found 15 unique batches
📊 Processing inventory for Product 5 - Found 15 unique batches
📊 Processing inventory for Product 6 - Found 18 unique batches
📊 Processing inventory for Product 7 - Found 9 unique batches
📊 Processing inventory for Product 8 - Found 19 unique batches
📊 Processing inventory for Product 9 - Found 23 unique batches
📊 Processing inventory for Product 10 - Found 12 unique batches
📊 Processing inventory for Product 11 - Found 12 unique batches
📊 Processing inventory for Product 12 - Found 15 unique batches
📊 Processing inventory for Product 13 - Found 20 unique batches
📊 Processing inventory for Product 14 - Found 15 unique batches
📊 Processing inventory for Product 15 - Found 14 unique batches
📊 Processing inventory for Product 16 - Found 14 unique batches
📊 Processing inventory for Product 17 - Found 19 unique batches
📊 Processing inventory for Product 18 - Found 18 unique batches
📊 Processing inventory for Product 19 - Found 15 unique batches
📊 Processing inventory for Product 20 - Found 15 unique batches
📊 Processing inventory for Product 21 - Found 20 unique batches
📊 Processing inventory for Product 22 - Found 21 unique batches
📊 Processing inventory for Product 23 - Found 14 unique batches
📊 Processing inventory for Product 24 - Found 16 unique batches
📊 Processing inventory for Product 25 - Found 9 unique batches
📊 Processing inventory for Product 26 - Found 13 unique batches
📊 Processing inventory for Product 28 - Found 9 unique batches
📊 Processing inventory for Product 29 - Found 15 unique batches
📊 Processing inventory for Product 27 - Found 10 unique batches
📊 Processing inventory for Product 31 - Found 12 unique batches
📊 Processing inventory for Product 32 - Found 28 unique batches
📊 Processing inventory for Product 30 - Found 13 unique batches
📊 Processing inventory for Product 33 - Found 16 unique batches
📊 Processing inventory for Product 34 - Found 10 unique batches
📊 Processing inventory for Product 35 - Found 14 unique batches
📊 Processing inventory for Product 42 - Found 16 unique batches
📊 Processing inventory for Product 36 - Found 16 unique batches
📊 Processing inventory for Product 37 - Found 13 unique batches
📊 Processing inventory for Product 38 - Found 12 unique batches
📊 Processing inventory for Product 39 - Found 14 unique batches
📊 Processing inventory for Product 40 - Found 14 unique batches
📊 Processing inventory for Product 41 - Found 14 unique batches
📊 Processing inventory for Product 44 - Found 13 unique batches
📊 Processing inventory for Product 43 - Found 14 unique batches
📊 Processing inventory for Product 45 - Found 14 unique batches
📊 Processing inventory for Product 46 - Found 21 unique batches
📊 Processing inventory for Product 47 - Found 16 unique batches
📊 Processing inventory for Product 48 - Found 14 unique batches
📊 Processing inventory for Product 49 - Found 10 unique batches
📊 Processing inventory for Product 50 - Found 22 unique batches
📊 Processing inventory for Product 2 - Found 23 unique batches
📊 Processing inventory for Product 3 - Found 14 unique batches
📊 Processing inventory for Product 1 - Found 20 unique batches
📊 Processing inventory for Product 4 - Found 15 unique batches
📊 Processing inventory for Product 5 - Found 15 unique batches
📊 Processing inventory for Product 6 - Found 18 unique batches
📊 Processing inventory for Product 7 - Found 9 unique batches
📊 Processing inventory for Product 8 - Found 19 unique batches
📊 Processing inventory for Product 9 - Found 23 unique batches
📊 Processing inventory for Product 10 - Found 12 unique batches
📊 Processing inventory for Product 11 - Found 12 unique batches
📊 Processing inventory for Product 12 - Found 15 unique batches
📊 Processing inventory for Product 13 - Found 20 unique batches
📊 Processing inventory for Product 14 - Found 15 unique batches
📊 Processing inventory for Product 15 - Found 14 unique batches
📊 Processing inventory for Product 16 - Found 14 unique batches
📊 Processing inventory for Product 17 - Found 19 unique batches
📊 Processing inventory for Product 18 - Found 18 unique batches
📊 Processing inventory for Product 19 - Found 15 unique batches
📊 Processing inventory for Product 20 - Found 15 unique batches
📊 Processing inventory for Product 21 - Found 20 unique batches
📊 Processing inventory for Product 22 - Found 21 unique batches
📊 Processing inventory for Product 23 - Found 14 unique batches
📊 Processing inventory for Product 24 - Found 16 unique batches
📊 Processing inventory for Product 25 - Found 9 unique batches
📊 Processing inventory for Product 26 - Found 13 unique batches
📊 Processing inventory for Product 28 - Found 9 unique batches
📊 Processing inventory for Product 29 - Found 15 unique batches
📊 Processing inventory for Product 27 - Found 10 unique batches
📊 Processing inventory for Product 31 - Found 12 unique batches
📊 Processing inventory for Product 32 - Found 28 unique batches
📊 Processing inventory for Product 30 - Found 13 unique batches
📊 Processing inventory for Product 33 - Found 16 unique batches
📊 Processing inventory for Product 34 - Found 10 unique batches
📊 Processing inventory for Product 35 - Found 14 unique batches
📊 Processing inventory for Product 42 - Found 16 unique batches
📊 Processing inventory for Product 36 - Found 16 unique batches
📊 Processing inventory for Product 37 - Found 13 unique batches
📊 Processing inventory for Product 38 - Found 12 unique batches
📊 Processing inventory for Product 39 - Found 14 unique batches
📊 Processing inventory for Product 40 - Found 14 unique batches
📊 Processing inventory for Product 41 - Found 14 unique batches
📊 Processing inventory for Product 44 - Found 13 unique batches
📊 Processing inventory for Product 43 - Found 14 unique batches
📊 Processing inventory for Product 45 - Found 14 unique batches
📊 Processing inventory for Product 46 - Found 21 unique batches
📊 Processing inventory for Product 47 - Found 16 unique batches
📊 Processing inventory for Product 48 - Found 14 unique batches
📊 Processing inventory for Product 49 - Found 10 unique batches
📊 Processing inventory for Product 50 - Found 22 unique batches
  ⚠ SLOW: 50.656s (max: 53.687s)

Testing: Contra Entries...
  ✓ PASSED: 0.025s (max: 0.079s)

============================================================
DATABASE QUERY TESTING
============================================================
✓ Products            : 2.17ms (1 queries)
✓ Suppliers           : 1.53ms (1 queries)
✓ Customers           : 2.00ms (1 queries)
✓ Purchases           : 4.52ms (1 queries)
✓ Sales               : 5.00ms (1 queries)

============================================================
DATA SCALABILITY TESTING
============================================================
Products                 : 3,384
Suppliers                : 53
Customers                : 101
Purchase Invoices        : 26,002
Purchases                : 26,001
Sales Invoices           : 26,001
Sales                    : 26,001
Purchase Returns         : 36,000
Sales Returns            : 36,001
Supplier Challans        : 41,000
Customer Challans        : 26,000
Contra Entries           : 1
===================================
TOTAL RECORDS            : 246,545
===================================
✓ SCALABILITY: Excellent (>10K records)

============================================================
CONCURRENT LOAD TESTING
============================================================
Simulating 10 concurrent users...
Dashboard: Checking 20 products for low stock
Dashboard: Checking 20 products for low stock
Dashboard: Checking 20 products for low stock
Dashboard: Checking 20 products for low stock
Dashboard: Checking 20 products for low stock
Dashboard: Checking 20 products for low stock
Dashboard: Checking 20 products for low stock
Dashboard: Checking 20 products for low stock
Dashboard: Checking 20 products for low stock
Dashboard: Checking 20 products for low stock
Dashboard: Total low stock products found: 0
Dashboard: Looking for products expiring before 2026-01-15
Dashboard: Found 50 purchases with expiry dates
Dashboard: Total expired/expiring products found: 0
Dashboard: Total low stock products found: 0
Dashboard: Looking for products expiring before 2026-01-15
Dashboard: Found 50 purchases with expiry dates
Dashboard: Total low stock products found: 0
Dashboard: Looking for products expiring before 2026-01-15
Dashboard: Found 50 purchases with expiry dates
Dashboard: Total low stock products found: 0
Dashboard: Total expired/expiring products found: 0
Dashboard: Total expired/expiring products found: 0
Dashboard: Looking for products expiring before 2026-01-15
Dashboard: Found 50 purchases with expiry dates
Dashboard: Total expired/expiring products found: 0
Dashboard: Total low stock products found: 0
Dashboard: Looking for products expiring before 2026-01-15
Dashboard: Found 50 purchases with expiry dates
Dashboard: Total expired/expiring products found: 0
Dashboard: Total low stock products found: 0
Dashboard: Looking for products expiring before 2026-01-15
Dashboard: Found 50 purchases with expiry dates
Dashboard: Total expired/expiring products found: 0
Dashboard: Total low stock products found: 0
Dashboard: Looking for products expiring before 2026-01-15
Dashboard: Found 50 purchases with expiry dates
Dashboard: Total expired/expiring products found: 0
Dashboard: Total low stock products found: 0
Dashboard: Looking for products expiring before 2026-01-15
Dashboard: Found 50 purchases with expiry dates
Dashboard: Total expired/expiring products found: 0
Dashboard: Total low stock products found: 0
Dashboard: Looking for products expiring before 2026-01-15
Dashboard: Found 50 purchases with expiry dates
Dashboard: Total expired/expiring products found: 0
Dashboard: Total low stock products found: 0
Dashboard: Looking for products expiring before 2026-01-15
Dashboard: Found 50 purchases with expiry dates
Dashboard: Total expired/expiring products found: 0
